{
  "schema_version": 1,
  "id": "example-llm",
  "source": "local:requests/llm.json",
  "summary": "Adjust internal prompt formatting without changing the accepted output contract.",
  "confirmation": "confirmed",
  "change": "enhancement",
  "scope": [
    "src"
  ],
  "impacts": {
    "bounded": true,
    "within-contracts": true,
    "new-behavior": true,
    "security": false,
    "auth": false,
    "data": false,
    "public-contract": false,
    "nfr": false,
    "ownership": false,
    "architecture": false,
    "cross-service": false,
    "llm": true,
    "mcp": false
  },
  "acceptance": [
    "The pinned evaluation cases pass, with test inputs and outputs retained locally."
  ],
  "references": [
    {
      "kind": "nfr",
      "reference": "architecture.md",
      "authority": "accepted"
    }
  ],
  "preference": "auto"
}
